{
  "project_id": "1289267",
  "app_name": "التجربة العربية",
  "tagline": "رحلة تسوق عربية أصيلة",
  "preset": "standard",
  "theme": {
    "primary_color": "#FF7F50",
    "accent_color": "#FF4500"
  },
  "banner": {
    "title": "مرحباً بكم في متجركم العربي",
    "subtitle": "اكتشفوا تشكيلة واسعة من المنتجات العربية الأصيلة"
  },
  "categories": [
    "الأزياء",
    "المأكولات",
    "الحرف اليدوية",
    "المنتجات الطبيعية",
    "الديكور المنزلي"
  ],
  "items": [
    {
      "title": "ثوب تقليدي",
      "desc": "ثوب رجالي تقليدي مصنوع يدوياً من أقمشة فاخرة",
      "price": "99.99 دولار",
      "icon": "category"
    },
    {
      "title": "قهوة عربية",
      "desc": "قهوة عربية عالية الجودة، مزيج أصيل من حبوب مختارة بعناية",
      "price": "29.99 دولار",
      "icon": "category"
    },
    {
      "title": "سجادة يدوية",
      "desc": "سجادة يدوية الصنع، تصميم عربي أصيل، ألوان زاهية",
      "price": "149.99 دولار",
      "icon": "category"
    },
    {
      "title": "زيت أركان طبيعي",
      "desc": "زيت أركان المغربي الأصلي، غني بمضادات الأكسدة",
      "price": "49.99 دولار",
      "icon": "category"
    },
    {
      "title": "مزهرية فخارية",
      "desc": "مزهرية فخارية يدوية الصنع، تصميم أنيق وأصيل",
      "price": "39.99 دولار",
      "icon": "category"
    }
  ],
  "nav_tabs": [
    {
      "id": "home",
      "label": "الرئيسية",
      "icon": "home"
    },
    {
      "id": "shopping_bag",
      "label": "عربة التسوق",
      "icon": "shopping-cart"
    },
    {
      "id": "settings",
      "label": "الملف الشخصي",
      "icon": "user"
    }
  ]
}