{
  "project_id": "1289254",
  "app_name": "تطبيق Standard الاحترافي",
  "tagline": "حل رقمي متكامل فائق السرعة والأداء",
  "preset": "standard",
  "theme": {
    "primary_color": "#4f46e5",
    "accent_color": "#06b6d4"
  },
  "banner": {
    "title": "عرض الإطلاق الحصري",
    "subtitle": "خصم 20% على جميع الطلبات"
  },
  "categories": [
    "الكل",
    "الأكثر طلباً",
    "العروض",
    "خدمات VIP"
  ],
  "items": [
    {
      "title": "باقة الخدمة الأساسية",
      "desc": "تنفيذ سريع مع دعم فني 24/7",
      "price": "149",
      "icon": "bolt"
    },
    {
      "title": "باقة الأعمال المتكاملة",
      "desc": "إدارة شاملة مع تقارير لحظية",
      "price": "299",
      "icon": "category"
    },
    {
      "title": "ترقية حصرية مخصصة",
      "desc": "تكامل سحابي متقدم",
      "price": "99",
      "icon": "star"
    }
  ],
  "nav_tabs": [
    {
      "id": "home",
      "label": "الرئيسية",
      "icon": "home"
    },
    {
      "id": "shopping_bag",
      "label": "الطلبات",
      "icon": "shopping_bag"
    },
    {
      "id": "settings",
      "label": "حسابي",
      "icon": "settings"
    }
  ]
}