{
  "project_id": "1289277",
  "app_name": "خدمات المونتاج الاحترافية",
  "tagline": "مونتاج احترافي لمقاطع الفيديو التعليمية والترويجية",
  "preset": "services",
  "theme": {
    "primary_color": "#007bff",
    "accent_color": "#ff4500"
  },
  "banner": {
    "title": "مونتاج احترافي لمقاطعك التعليمية",
    "subtitle": "ارتقِ بمقاطعك إلى مستوى جديد مع خبراء المونتاج"
  },
  "categories": [
    "مونتاج الفيديو",
    "خدمات المونتاج الاحترافية",
    "تصميم Motion Graphics"
  ],
  "items": [
    {
      "title": "مونتاج مقاطع تعليمية",
      "desc": "نحن نقدم خدمات مونتاج احترافية لمقاطع الفيديو التعليمية. فريقنا من المونتيرين المحترفين سيضمن لك مونتاجاً دقيقاً ومثيراً للاهتمام، مع التركيز على إبراز المعلومات المهمة بطريقة جذابة.",
      "price": "تبدأ الأسعار من 250 دولار للمقطع الواحد",
      "icon": "education"
    },
    {
      "title": "خدمات Motion Graphics",
      "desc": "نضيف لمسة احترافية لمقاطعك من خلال تصميم Motion Graphics جذابة. نضمن لك إبراز النصوص والمعلومات المهمة بطريقة مبتكرة وممتعة.",
      "price": "تبدأ الأسعار من 150 دولار لكل تصميم",
      "icon": "design"
    },
    {
      "title": "مونتاج مقاطع الشاشة",
      "desc": "هل تحتاج إلى مونتاج احترافي لمقاطع شاشة الكمبيوتر؟ نحن خبراء في استخدام تقنيات الزوم، والهايلايت، والكاليوتس لإبراز التفاصيل المهمة. نضمن لك مونتاجاً احترافياً ومؤثرات بصرية وصوتية جذابة.",
      "price": "تبدأ الأسعار من 300 دولار للمقطع الواحد",
      "icon": "computer"
    }
  ],
  "nav_tabs": [
    {
      "id": "home",
      "label": "الرئيسية",
      "icon": "home"
    },
    {
      "id": "cart",
      "label": "عربة التسوق",
      "icon": "shopping_cart"
    },
    {
      "id": "profile",
      "label": "الملف الشخصي",
      "icon": "person"
    }
  ]
}